{
    "signature": "SCOL",
    "type": "record",
    "name": "Static Collection",
    "def": {
        "members": [
            {
                "def": "EDID"
            },
            {
                "def": "OBND",
                "required": true
            },
            {
                "def": "MODL",
                "required": true
            },
            {
                "name": "Parts",
                "type": "structArray",
                "entryName": {
                    "name": "Part",
                    "type": "multiStruct",
                    "subrecords": [
                        {
                            "signature": "ONAM",
                            "type": "subrecord",
                            "def": {
                                "name": "Static",
                                "type": "formId",
                                "signatures": [
                                    "STAT"
                                ]
                            }
                        },
                        {
                            "signature": "DATA",
                            "type": "subrecord",
                            "def": {
                                "name": "Placements",
                                "entryDef": {
                                    "name": "Placement",
                                    "type": "struct",
                                    "fields": [
                                        {
                                            "name": "Position",
                                            "type": "struct",
                                            "fields": [
                                                {
                                                    "name": "X",
                                                    "type": "float"
                                                },
                                                {
                                                    "name": "Y",
                                                    "type": "float"
                                                },
                                                {
                                                    "name": "Z",
                                                    "type": "float"
                                                }
                                            ]
                                        },
                                        {
                                            "name": "Rotation",
                                            "type": "struct",
                                            "fields": [
                                                {
                                                    "name": "X",
                                                    "type": "float",
                                                    "required": true
                                                },
                                                {
                                                    "name": "Y",
                                                    "type": "float",
                                                    "required": true
                                                },
                                                {
                                                    "name": "Z",
                                                    "type": "float",
                                                    "required": true
                                                }
                                            ]
                                        },
                                        {
                                            "name": "Scale",
                                            "type": "float"
                                        }
                                    ]
                                },
                                "type": "array",
                                "size": 0
                            }
                        }
                    ]
                },
                "required": true
            }
        ]
    }
}