{
    "signature": "PLYR",
    "type": "record",
    "name": "Player Reference",
    "def": {
        "members": [
            {
                "def": "EDID"
            },
            {
                "signature": "PLYR",
                "type": "subrecord",
                "field": {
                    "name": "Player",
                    "type": "formId"
                },
                "required": true,
                "defaultNativeValue": 7
            }
        ]
    }
}