{
    "signature": "SHOU",
    "type": "record",
    "name": "Shout",
    "def": {
        "flags": {
            "type": "flags",
            "flags": {
                "7": "Treat spells as powers",
                "12": "Ignored"
            }
        },
        "members": [
            {
                "def": "EDID"
            },
            {
                "def": "FULL"
            },
            {
                "def": "MDOB"
            },
            {
                "def": "DESC"
            },
            {
                "name": "Words of Power",
                "type": "subrecordArray",
                "subrecord": {
                    "signature": "SNAM",
                    "type": "subrecord",
                    "def": {
                        "name": "",
                        "type": "struct",
                        "fields": [
                            {
                                "name": "Word",
                                "type": "formId",
                                "signatures": [
                                    "WOOP",
                                    "NULL"
                                ]
                            },
                            {
                                "name": "Spell",
                                "type": "formId",
                                "signatures": [
                                    "SPEL",
                                    "NULL"
                                ]
                            },
                            {
                                "name": "Recovery Time",
                                "type": "float"
                            }
                        ]
                    }
                }
            }
        ]
    }
}